{
  "$schema": "https://json-schema.org/draft/2020-12/schema",
  "type": "object",
  "properties": {
    "schema_version": {
      "const": 1,
      "type": "integer"
    },
    "kind": {
      "const": "channel",
      "type": "string"
    },
    "id": {
      "type": "string",
      "pattern": "^[a-z0-9][a-z0-9-]*$"
    },
    "account_url": {
      "type": "string",
      "minLength": 1
    },
    "account_context": {
      "type": "string",
      "enum": [
        "personal",
        "publication"
      ]
    },
    "mission": {
      "type": "string",
      "minLength": 1
    },
    "formats": {
      "type": "array",
      "items": {
        "type": "string",
        "minLength": 1
      },
      "minItems": 1,
      "uniqueItems": true
    },
    "guide": {
      "type": "string",
      "minLength": 1
    },
    "voice_policy": {
      "type": "string",
      "minLength": 1
    },
    "live_checks": {
      "type": "array",
      "items": {
        "type": "string",
        "minLength": 1
      },
      "minItems": 1,
      "uniqueItems": true
    },
    "lessons": {
      "type": "array",
      "items": {
        "type": "string",
        "minLength": 1
      },
      "minItems": 1,
      "uniqueItems": true
    },
    "publication_mode": {
      "type": "string",
      "enum": [
        "approved_brand_content",
        "approved_content_cadence",
        "human_publish_only"
      ]
    },
    "authority_ref": {
      "type": "string",
      "minLength": 1
    },
    "daily_posts_target": {
      "type": [
        "integer",
        "null"
      ],
      "minimum": 1,
      "maximum": 4
    },
    "daily_posts_floor": {
      "type": [
        "integer",
        "null"
      ],
      "minimum": 1,
      "maximum": 4,
      "description": "Optional; the fewest posts a day the weekly mix plans on this channel (engine/mix.py). Only on a channel with a daily_posts_target, never above it."
    },
    "daily_drafts_max": {
      "type": [
        "integer",
        "null"
      ],
      "minimum": 1,
      "maximum": 1
    }
  },
  "required": [
    "schema_version",
    "kind",
    "id",
    "account_url",
    "account_context",
    "mission",
    "formats",
    "guide",
    "voice_policy",
    "live_checks",
    "lessons",
    "publication_mode",
    "authority_ref",
    "daily_posts_target",
    "daily_drafts_max"
  ],
  "additionalProperties": false
}
