{
  "schema_version": 1,
  "kind": "channel",
  "id": "linkedin",
  "account_url": "https://www.linkedin.com/in/krish-raja/",
  "account_context": "personal",
  "mission": "Build trusted commercial-AI judgment and relevant professional relationships first. Reach and publication subscribers are secondary. No daily volume quota; Krish reviews and manually publishes.",
  "formats": [
    "carousel",
    "single-image",
    "text",
    "short-video"
  ],
  "guide": "social/guides/linkedin.md",
  "voice_policy": "docs/ACCOUNT-VOICE.md",
  "live_checks": [
    "Verify signed-in native ownership and intended account; connection alone does not grant scope.",
    "Read current queue, drafts and native identities; preserve existing human work.",
    "Verify the exact destination, visibility and available account capabilities before the selected action."
  ],
  "lessons": [
    "revision-identity",
    "growth-measurement",
    "personal-account-register",
    "linkedin-scorecard-edition",
    "document-upload-unverified",
    "nullable-preview-clear",
    "publishing-authority-split",
    "buffer-document-preview-hold",
    "linkedin-reader-continuation"
  ],
  "publication_mode": "human_publish_only",
  "authority_ref": "docs/PUBLISHING-AUTHORITY.md",
  "daily_posts_target": null,
  "daily_drafts_max": null
}
